{
  "schema": "ev4-builder-intake-result@0.1.0",
  "workflow_mode": "START_INTAKE_MODE",
  "runtime_state": "EVIDENCE_REQUIRED",
  "present_inputs": [
    "Builder_Context_Package",
    "checkpoint_or_status_summary"
  ],
  "validated_inputs": [
    "Builder_Context_Package"
  ],
  "blocking_missing_inputs": [],
  "optional_missing_inputs": [
    "reference_screenshot"
  ],
  "conflicts": [
    "checkpoint selected_candidate_id does not match Builder_Context_Package selected_candidate_id"
  ],
  "package_status": "approved_handoff",
  "selected_candidate_id": "ARCH-FAM-C",
  "package_digest": "sha256:test-conflict",
  "decision": "blocked_conflict",
  "eligible_workflow_mode": "START_INTAKE_MODE",
  "eligible_runtime_state": "EVIDENCE_REQUIRED",
  "guidance": [
    "Resolve the package/checkpoint conflict before entering APPROVED_HANDOFF_MODE."
  ]
}
