{
  "schema": "ev4-builder-intake-result@0.1.0",
  "workflow_mode": "APPROVED_HANDOFF_MODE",
  "runtime_state": "BUILD_ACTIVE",
  "present_inputs": [
    "Builder_Context_Package",
    "reference_screenshot",
    "elementor_structure_or_editor_screenshot"
  ],
  "validated_inputs": [
    "Builder_Context_Package"
  ],
  "blocking_missing_inputs": [],
  "optional_missing_inputs": [],
  "conflicts": [],
  "package_status": "approved_handoff",
  "selected_candidate_id": "ARCH-FAM-C",
  "package_digest": "sha256:test-approved",
  "decision": "approved",
  "eligible_workflow_mode": "APPROVED_HANDOFF_MODE",
  "eligible_runtime_state": "BUILD_ACTIVE",
  "guidance": [
    "Package is valid; begin approved handoff without changing selected_candidate_id."
  ]
}
